rank,perf_tier,product_name,manufacturer,category,description,approx_price_usd,price_basis,hp_gain,torque_gain_pct,fuel_efficiency_gain_pct,estimated_roi_percent,payback_hours,fits_production,compatibility_notes
1,Top Tier,Donaldson PowerCore Air Filter,Donaldson,Engine / Intake,High-capacity air filtration - drops into M8 factory airbox,350.00,per tractor,2,1,2,250,100,Yes - same dimensions as factory M8 air filter,Direct replacement for TC422-93240/TC422-93241
2,Top Tier,LED Light Conversion Kit,Grote Industries,Electrical / Lighting,Full LED conversion for M8 production light housings,1000.00,per tractor,0,0,0,200,200,Yes - direct replacement in M8 light housings,All M8-211 cab and hood positions
3,Top Tier,Derale Auxiliary Trans Cooler,Derale Performance,Transmission / Cooling,Add-on K-VT oil cooler for M8 trans lines,600.00,per tractor,0,0,0,200,200,Yes - inline on M8 production trans cooler hoses,Reduces K-VT oil temp 15-25 deg F
4,Top Tier,aFe Power Intake Kit,aFe Power,Engine / Intake,High-flow intake for Kubota V5009 engine,400.00,per tractor,5,3,4,180,150,Yes - fits M8 production airbox mounting,Kubota V5009 5.0L engine
5,Top Tier,AG Diesel Solutions Module,AG Diesel Solutions,Engine / ECU Tuning,Inline fuel controller for Kubota V5009 injection,1300.00,per tractor,18,9,6,130,350,Yes - inline connector on M8 fuel rail harness,Kubota V5009 engine
6,Top Tier,Setrab K-VT Trans Cooler,Setrab Oil Coolers,Transmission / Cooling,Stacked-plate K-VT cooler replacing M8 unit,1200.00,per tractor,0,0,0,160,250,Yes - same fittings as M8 K-VT cooler,30% more capacity for K-VT CVT
7,Top Tier,Outback eDriveX Steering,Hemisphere GNSS,Guidance / Steering,Aftermarket sub-inch auto-steer for M8 steering,6500.00,per tractor,0,0,8,120,500,Yes - universal mount fits M8 steering column,Alternative to Kubota auto-steer
8,Top Tier,Titan Bolt-On Wheel Weights,Titan Machinery,Ballast / Traction,Precision-fit wheel weights for M8 rim bolt pattern,2000.00,per set,0,0,5,110,300,Yes - bolt-on to M8 production rim bolt circle,Matched to M8 axle ratings
9,Strong,Raven Viper 4+ Rate Controller,Raven Industries,Precision Ag / Rate Control,Universal VRA controller via M8 ISOBUS,4200.00,per tractor,0,0,0,95,600,Yes - ISOBUS standard on M8 models,5-12% input savings from VRA
10,Strong,Ag Leader InCommand 1200,Ag Leader Technology,Precision Ag / Display,Universal ISOBUS display for M8 cab,4800.00,per tractor,0,0,0,80,700,Yes - ISOBUS on M8 - cab bracket included,Alternative to K-Monitor Pro HD
11,Moderate,Firestone Maxi Traction IF,Firestone Ag,Tires / Traction,IF radial tires on M8 production rims,7200.00,per set of 4,0,0,4,75,800,Yes - fits M8 production rims,20% lower pressure - compaction reduction
12,Moderate,Prince High-Cap Hydraulic Pump,Prince Manufacturing,Hydraulics / Pump,Higher displacement pump for M8 pump mount,2400.00,per tractor,0,0,0,70,600,Yes - same mount and ports as M8 pump,15-20% more hydraulic flow
