rank,perf_tier,product_name,manufacturer,category,description,approx_price_usd,price_basis,estimated_yield_gain_bu_ac,estimated_roi_percent,payback_acres,fits_production,compatibility_notes
1,Top Tier,Mojo Wire,Ag Leader Technology,Seed Delivery,Stainless steel seed tube guard wire for finger pickup tubes,15.00,per row,1.0,250,15,Yes - installs inside MaxEmerge XP production seed tube,Best upgrade for finger pickup planters - pennies per row
2,Top Tier,Keeton Seed Firmer,Precision Planting,Seed Firming,In-furrow blade pressing seeds into moisture,30.00,per row,1.5,200,20,Yes - drops into MaxEmerge XP furrow opener slot,Universal fit on 7200/7300 row units
3,Top Tier,Martin Spading Closing Wheel,Martin Industries,Closing System,Spiked cast-iron closing wheel for XP bolt pattern,135.00,per row,1.5,120,90,Yes - same bolt pattern as MaxEmerge XP closing wheel,Direct replacement for XP closing wheels
4,Top Tier,vSet Meter,Precision Planting,Seed Metering,Electric vacuum meter replacing XP finger pickup meter,1200.00,per row,3.0,90,400,Yes - mounts on MaxEmerge XP row unit housing,Major upgrade from finger pickup to electric vacuum
5,Top Tier,Copperhead Ag Furrow Cruiser,Copperhead Ag,Closing System,Notched rubber closing wheel for XP bolt pattern,95.00,per row,1.0,115,85,Yes - same bolt pattern as XP closing wheel,Cost-effective in lighter soils
6,Top Tier,SpeedTube,Precision Planting,Seed Delivery,Electric seed tube eliminating bounce in XP tubes,850.00,per row,2.5,85,320,Yes - replaces MaxEmerge XP production seed tube,Critical upgrade for XP planters running over 5 mph
7,Top Tier,SmartFirmer,Precision Planting,Seed Firming / Sensing,In-furrow firmer with OM and moisture sensors,350.00,per row,2.0,80,175,Yes - drops into MaxEmerge XP furrow slot,Firms seed plus real-time soil data
8,Top Tier,Yetter SharkTooth Closing Wheel,Yetter Manufacturing,Closing System,Aggressive tooth closing wheel for XP bolt pattern,110.00,per row,1.0,100,110,Yes - same bolt pattern as XP closing wheel,Aggressive fracturing in wet clay
9,Strong,FurrowForce,Precision Planting,Closing System,Dual-action closing system for XP closing position,750.00,per row,2.0,75,375,Yes - mounts on MaxEmerge XP closing wheel position,Replaces standard XP closing system
10,Strong,DeltaForce,Precision Planting,Downforce,Hydraulic active downforce for XP row units,1500.00,per row,2.0,70,500,Yes - replaces MaxEmerge XP production springs,Replaces mechanical springs on XP parallel arms
11,Strong,CleanSweep,Precision Planting,Row Cleaning,Hydraulic row cleaner for XP toolbar,650.00,per row,1.5,65,430,Yes - mounts ahead of MaxEmerge XP row unit,Bolt-on to 7200/7300 toolbar
12,Strong,vDrive Electric Drive,Precision Planting,Seed Metering / Drive,Electric row drive replacing XP mechanical chain drive,950.00,per row,2.0,70,450,Yes - replaces MaxEmerge XP chain/shaft drive,Eliminates chain wear - individual row variable rate
13,Strong,20/20 SeedSense Gen3,Precision Planting,Monitoring / Display,Advanced monitor replacing basic XP planter monitor,4200.00,per planter,2.0,45,1200,Yes - CAN harness for 7200/7300 row units,Major visibility upgrade from basic XP monitor
14,Moderate,WaveVision,Precision Planting,Monitoring / Sensing,High-frequency seed sensor for XP seed tubes,350.00,per row,1.0,50,350,Yes - installs in MaxEmerge XP seed tube,Replaces optical sensors on older 7200/7300
